<?xml version="1.0"?>
<!DOCTYPE log4d:eventSet SYSTEM "log4d.dtd">
<log4d:eventSet version="1.2" xmlns:log4d="http://log4d.sourceforge.net/log4d">

<log4d:event logger="alt" levelName="FATAL" levelValue="50000" thread="1772" timestamp="20030924222937763" elapsed="23443"><log4d:message><![CDATA[adasdas]]></log4d:message></log4d:event>

<log4d:event logger="alt" levelName="ERROR" levelValue="40000" thread="1772" timestamp="20030924222939776" elapsed="25456"><log4d:message><![CDATA[adasdas]]></log4d:message></log4d:event>

<log4d:event logger="alt" levelName="WARN" levelValue="30000" thread="1772" timestamp="20030924222941899" elapsed="27579"><log4d:message><![CDATA[adasdas]]></log4d:message></log4d:event>

<log4d:event logger="alt" levelName="INFO" levelValue="20000" thread="1772" timestamp="20030924222947608" elapsed="33288"><log4d:message><![CDATA[adasdas]]></log4d:message></log4d:event>

</log4d:eventSet>

